{
  "schemaVersion": "1.0.0",
  "evaluationId": "example-eval-20260713T120000-0700",
  "strategyId": "klax-current-five-model-2026-07-11",
  "weightingRevision": "klax-stage-adaptive-weights-2026-07-13",
  "weightingConfigHash": "example12345678",
  "evaluatedAt": "2026-07-13T12:00:00-07:00",
  "targetDate": "2026-07-13",
  "primaryMode": "stage_reliability",
  "status": "READY",
  "stage": {
    "stageId": "target_11_13",
    "transitionFromStage": null,
    "transitionAlpha": 1.0,
    "transitionMinutes": 30
  },
  "models": [
    {
      "modelKey": "ecmwf_ifs",
      "family": "ECMWF",
      "available": true,
      "eligible": true,
      "fixedPrior": 0.2,
      "stagePrior": 0.2,
      "stageHistoryDates": 36,
      "stageNEff": 35.105733398285075,
      "stageLogLoss": 0.72,
      "shrunkLogLoss": 1.2138548788037853,
      "reliabilityMultiplier": 0.8786130790320842,
      "preCapWeight": 0.18798293316998324,
      "individualCapApplied": false,
      "familyCapApplied": false,
      "maturityCap": 1.0,
      "maturityCapApplied": false,
      "finalWeight": 0.24143422278429055,
      "weightingStatus": "ready",
      "exclusionReason": null
    },
    {
      "modelKey": "gfs013",
      "family": "GFS",
      "available": true,
      "eligible": true,
      "fixedPrior": 0.25,
      "stagePrior": 0.21,
      "stageHistoryDates": 36,
      "stageNEff": 35.105733398285075,
      "stageLogLoss": 0.61,
      "shrunkLogLoss": 1.1545416590265383,
      "reliabilityMultiplier": 0.9323029704286595,
      "preCapWeight": 0.20944361485741222,
      "individualCapApplied": false,
      "familyCapApplied": true,
      "maturityCap": 1.0,
      "maturityCapApplied": false,
      "finalWeight": 0.20217058626315065,
      "weightingStatus": "ready",
      "exclusionReason": null
    },
    {
      "modelKey": "gfs_seamless",
      "family": "GFS",
      "available": true,
      "eligible": true,
      "fixedPrior": 0.2,
      "stagePrior": 0.24,
      "stageHistoryDates": 36,
      "stageNEff": 35.105733398285075,
      "stageLogLoss": 0.48,
      "shrunkLogLoss": 1.0844442174716094,
      "reliabilityMultiplier": 1.0,
      "preCapWeight": 0.25674500549489593,
      "individualCapApplied": false,
      "familyCapApplied": true,
      "maturityCap": 1.0,
      "maturityCapApplied": false,
      "finalWeight": 0.24782941373684939,
      "weightingStatus": "ready",
      "exclusionReason": null
    },
    {
      "modelKey": "nam",
      "family": "NAM",
      "available": true,
      "eligible": true,
      "fixedPrior": 0.15,
      "stagePrior": 0.17,
      "stageHistoryDates": 36,
      "stageNEff": 35.105733398285075,
      "stageLogLoss": 0.69,
      "shrunkLogLoss": 1.1976785461372634,
      "reliabilityMultiplier": 0.8929413938331044,
      "preCapWeight": 0.16239125550529615,
      "individualCapApplied": false,
      "familyCapApplied": false,
      "maturityCap": 1.0,
      "maturityCapApplied": false,
      "finalWeight": 0.20856577721570943,
      "weightingStatus": "ready",
      "exclusionReason": null
    },
    {
      "modelKey": "nbm",
      "family": "NBM",
      "available": true,
      "eligible": true,
      "fixedPrior": 0.2,
      "stagePrior": 0.18,
      "stageHistoryDates": 36,
      "stageNEff": 35.105733398285075,
      "stageLogLoss": 0.57,
      "shrunkLogLoss": 1.1329732154711754,
      "reliabilityMultiplier": 0.9526297145492565,
      "preCapWeight": 0.18343719097241248,
      "individualCapApplied": false,
      "familyCapApplied": false,
      "maturityCap": 0.1,
      "maturityCapApplied": true,
      "finalWeight": 0.1,
      "weightingStatus": "ready",
      "exclusionReason": null
    }
  ],
  "familyTotals": {
    "ECMWF": 0.24143422278429055,
    "GFS": 0.45000000000000007,
    "NAM": 0.20856577721570943,
    "NBM": 0.1
  },
  "counterfactuals": [
    {
      "mode": "fixed_baseline",
      "isPrimary": false,
      "weights": {
        "ecmwf_ifs": 0.2571428571428571,
        "gfs013": 0.25,
        "gfs_seamless": 0.2,
        "nam": 0.19285714285714284,
        "nbm": 0.1
      },
      "selectedMarketTicker": null,
      "selectedSide": null,
      "selectedPTrade": null
    },
    {
      "mode": "stage_prior_only",
      "isPrimary": false,
      "weights": {
        "ecmwf_ifs": 0.24324324324324323,
        "gfs013": 0.21,
        "gfs_seamless": 0.24000000000000002,
        "nam": 0.20675675675675675,
        "nbm": 0.1
      },
      "selectedMarketTicker": null,
      "selectedSide": null,
      "selectedPTrade": null
    },
    {
      "mode": "stage_reliability",
      "isPrimary": true,
      "weights": {
        "ecmwf_ifs": 0.24143422278429055,
        "gfs013": 0.20217058626315065,
        "gfs_seamless": 0.24782941373684939,
        "nam": 0.20856577721570943,
        "nbm": 0.1
      },
      "selectedMarketTicker": null,
      "selectedSide": null,
      "selectedPTrade": null
    }
  ]
}